{
  "meta": {
    "slug": "teczka-pojazdy",
    "tytul": "Teczka tematyczna: Pojazdy",
    "podtytul": "Jeden temat, dwadzieścia aktywności",
    "archetyp": "SEGREGATOR",
    "wersja": "1.0",
    "wiek": "3–6 lat",
    "kategoria": "busy",
    "podkategoria": "teczki",
    "strony_deklarowane": 48,
    "min_pt_dziecka": 14
  },
  "wstep": {
    "dla_kogo": "Dla dziecka, które od pół roku mówi wyłącznie o koparkach.",
    "obietnica": "Dwadzieścia aktywności wokół jednego tematu, który dziecko i tak kocha — i nie trzeba go do nich namawiać.",
    "warunek_wejscia": "Dziecko dopasowuje obrazek do obrazka i utrzymuje uwagę przez pięć minut.",
    "ile_czasu_dziennie": "Od dziesięciu do dwudziestu minut, raz dziennie.",
    "jak_korzystac": [
      "Przygotuj jedną sekcję naraz. Pierwsza wystarczy na dwa tygodnie.",
      "Wydrukuj, zalaminuj, wytnij i naklej rzepy. Instrukcja jest na pierwszej stronie sekcji.",
      "Wepnij planszę w koszulkę i włóż do segregatora z twardymi okładkami.",
      "Na stole zostaw jedną planszę i jej elementy. Reszta czeka w segregatorze.",
      "Polecenia dla dziecka czytasz na głos. Dziecko pokazuje palcem i przekłada elementy.",
      "Nazywaj pojazdy tak, jak nazywa je dziecko. Swoją nazwę dopowiedz obok.",
      "Elementy są małe. Zostań przy dziecku i chowaj woreczki po zabawie.",
      "Kończ, zanim dziecko się znudzi. Lepiej dziesięć minut niż trzydzieści.",
      "Sekcje możesz robić w dowolnej kolejności, ale rosną trudnością."
    ],
    "czego_nie_robi": [
      "Nie jest encyklopedią pojazdów.",
      "Nie uczy czytania — aktywności są obrazkowe.",
      "Wymaga zalaminowania, żeby przetrwała dłużej niż tydzień."
    ]
  },
  "sekcje": [
    {
      "temat": "Dopasowanie",
      "poziom": 1,
      "instrukcja_przygotowania": {
        "id": "s1-instrukcja",
        "typ": "lista_krokow",
        "polecenie": "Przygotuj sekcję przed pierwszą zabawą.",
        "dane": {
          "kroki": [
            "Wydrukuj wszystkie strony tej sekcji na grubym papierze.",
            "Zalaminuj arkusze albo oklej je szeroką taśmą klejącą.",
            "Wytnij elementy po liniach cięcia i zaokrąglij rogi nożyczkami.",
            "Naklej rzepy: miękki na planszy, twardy na spodzie elementu.",
            "Elementy są małe. Zostań przy dziecku przez całą zabawę.",
            "Po zabawie schowaj elementy do woreczka poza zasięgiem dziecka.",
            "Planszę wepnij w koszulkę i włóż do segregatora.",
            "Karty do rysowania zostaw bez laminowania — dziecko rysuje po nich ołówkiem."
          ]
        },
        "dla_rodzica": "Przygotowanie sekcji zajmuje około 30 minut. Zrób je bez dziecka przy stole."
      },
      "plansza_bazowa": {
        "id": "s1-plansza",
        "typ": "sortowanie",
        "polecenie": "Połóż pojazd na pasującym polu.",
        "dane": {
          "elementy": [
            "koparka",
            "autobus",
            "traktor",
            "rower",
            "pociąg",
            "śmieciarka"
          ],
          "kategorie": [
            {
              "nazwa": "pole z koparką",
              "naleza": [
                "koparka"
              ]
            },
            {
              "nazwa": "pole z autobusem",
              "naleza": [
                "autobus"
              ]
            },
            {
              "nazwa": "pole z traktorem",
              "naleza": [
                "traktor"
              ]
            },
            {
              "nazwa": "pole z rowerem",
              "naleza": [
                "rower"
              ]
            },
            {
              "nazwa": "pole z pociągiem",
              "naleza": [
                "pociąg"
              ]
            },
            {
              "nazwa": "pole ze śmieciarką",
              "naleza": [
                "śmieciarka"
              ]
            }
          ]
        },
        "dla_rodzica": "Zacznij od trzech pól. Resztę zasłoń kartką i dołóż po kilku dniach."
      },
      "elementy_ruchome": {
        "id": "s1-elementy",
        "typ": "elementy_ruchome",
        "polecenie": "Wytnij elementy do planszy dopasowania.",
        "dane": {
          "elementy": [
            {
              "nazwa": "koparka",
              "ile": 2
            },
            {
              "nazwa": "autobus",
              "ile": 2
            },
            {
              "nazwa": "traktor",
              "ile": 2
            },
            {
              "nazwa": "rower",
              "ile": 2
            },
            {
              "nazwa": "pociąg",
              "ile": 2
            },
            {
              "nazwa": "śmieciarka",
              "ile": 2
            }
          ],
          "rzep": "Miękką część rzepu naklej na środku pola na planszy, twardą na spodzie wyciętego pojazdu."
        },
        "dla_rodzica": "Drugi komplet trzymaj w zapasie. Elementy giną pod kanapą szybciej, niż się wydaje."
      },
      "dodatkowe": [
        {
          "id": "s1-d01",
          "typ": "lacz_pary",
          "polecenie": "Połącz pojazd z miejscem pracy.",
          "dane": {
            "lewa": [
              "koparka",
              "traktor",
              "autobus",
              "pociąg",
              "śmieciarka",
              "wóz strażacki"
            ],
            "prawa": [
              "przystanek",
              "tory",
              "plac budowy",
              "remiza",
              "pole",
              "ulica z koszami"
            ],
            "pary": [
              [
                0,
                2
              ],
              [
                1,
                4
              ],
              [
                2,
                0
              ],
              [
                3,
                1
              ],
              [
                4,
                5
              ],
              [
                5,
                3
              ]
            ]
          },
          "dla_rodzica": "Przeczytaj oba słowa na głos, potem poprowadź palec dziecka po linii."
        },
        {
          "id": "s1-d02",
          "typ": "karty_do_wyciecia",
          "polecenie": "Narysuj pojazd w pustym polu.",
          "dane": {
            "karty": [
              {
                "awers": "koparka",
                "rewers": "ma łyżkę i kopie dół"
              },
              {
                "awers": "autobus",
                "rewers": "wozi ludzi między przystankami"
              },
              {
                "awers": "traktor",
                "rewers": "ciągnie przyczepę po polu"
              },
              {
                "awers": "rower",
                "rewers": "ma dwa koła i pedały"
              },
              {
                "awers": "pociąg",
                "rewers": "jedzie po torach z wagonami"
              },
              {
                "awers": "śmieciarka",
                "rewers": "zabiera kosze spod domów"
              },
              {
                "awers": "betoniarka",
                "rewers": "miesza beton w obracającym się bębnie"
              },
              {
                "awers": "wóz strażacki",
                "rewers": "wiezie drabinę i wodę"
              }
            ],
            "na_arkuszu": 8,
            "z_podpisami": false
          },
          "dla_rodzica": "Nazwę pojazdu czytasz ty, dziecko rysuje w pustym polu. Kreski wystarczą."
        },
        {
          "id": "s1-d03",
          "typ": "lacz_pary",
          "polecenie": "Połącz pojazd z tym, co wozi.",
          "dane": {
            "lewa": [
              "koparka",
              "śmieciarka",
              "autobus",
              "betoniarka",
              "traktor",
              "ciężarówka"
            ],
            "prawa": [
              "beton",
              "piasek",
              "paczki",
              "pasażerowie",
              "worki ze śmieciami",
              "siano"
            ],
            "pary": [
              [
                0,
                1
              ],
              [
                1,
                4
              ],
              [
                2,
                3
              ],
              [
                3,
                0
              ],
              [
                4,
                5
              ],
              [
                5,
                2
              ]
            ]
          },
          "dla_rodzica": "Jeśli dziecko się waha, zapytaj: co ten pojazd ma w środku?"
        },
        {
          "id": "s1-d04",
          "typ": "ramka_rysunkowa",
          "polecenie": "Narysuj pojazd, który dziś widzieliście.",
          "dane": {
            "wyrazy": [
              "pojazd z rana",
              "pojazd po drodze",
              "pojazd przed domem"
            ],
            "wysokosc_ramki_mm": 55
          },
          "dla_rodzica": "Rysuj razem na jednej ramce, jeśli dziecko nie chce zaczynać samo."
        },
        {
          "id": "s1-d05",
          "typ": "wybierz",
          "polecenie": "Pokaż pojazd, o którym mówi dorosły.",
          "dane": {
            "pozycje": [
              {
                "podpowiedz_rodzica": "Ma dużą łyżkę i kopie dół.",
                "opcje": [
                  "koparka",
                  "rower",
                  "autobus"
                ],
                "poprawna": 0
              },
              {
                "podpowiedz_rodzica": "Zabiera worki ze śmieciami spod domu.",
                "opcje": [
                  "pociąg",
                  "śmieciarka",
                  "traktor"
                ],
                "poprawna": 1
              },
              {
                "podpowiedz_rodzica": "Jedzie po torach i ciągnie wagony.",
                "opcje": [
                  "rower",
                  "autobus",
                  "pociąg"
                ],
                "poprawna": 2